{
  "$schema": "https://json-schema.org/draft/2020-12/schema",
  "$id": "https://provenance.dev/upc/1.8.0/schemas/synthesis.schema.json",
  "title": "UPC Synthesis",
  "description": "Multi-source analysis combining evidence across sources (literature review, comparison, memo, answer, evidence matrix). Built from a claim register where each claim cites the evidence and sources that support it. The rendered output MUST cite every id its claims depend on, its bytes are pinned by output.sha256, and every quotation in it is gated by hop C (§04). input_digest lives in provenance only.",
  "type": "object",
  "required": ["synthesis_id", "type", "provenance"],
  "properties": {
    "synthesis_id": { "type": "string", "description": "syn-<12hex> (§06)." },
    "aliases": { "type": "object", "additionalProperties": { "type": "string" } },
    "type": { "$ref": "../vocab/vocab.json#/$defs/synthesis_type" },
    "title": { "type": "string" },
    "question": { "type": "string", "description": "The research question or task this synthesis answers." },
    "claims": {
      "type": "array",
      "items": {
        "type": "object",
        "required": ["claim_id", "text"],
        "properties": {
          "claim_id": { "type": "string" },
          "text": { "type": "string" },
          "evidence_ids": { "type": "array", "items": { "type": "string" } },
          "source_ids": { "type": "array", "items": { "type": "string" } },
          "confidence": { "$ref": "../vocab/vocab.json#/$defs/confidence" },
          "notes": { "type": ["string", "null"] }
        },
        "additionalProperties": true
      }
    },
    "output": {
      "type": "object",
      "properties": {
        "path": { "type": "string", "description": "Corpus-relative path to the rendered synthesis (e.g. synthesis.md), generated from claims." },
        "value": {},
        "media_type": { "type": "string" },
        "sha256": { "type": "string", "description": "Hex sha256 of the output file's bytes; required at L2 for a path output." }
      },
      "additionalProperties": true
    },
    "stale": { "type": "boolean" },
    "supersedes": { "type": "string", "pattern": "^syn-[0-9a-f]{12}$", "description": "1.15.0: the synthesis this one revises (§04 Revising a synthesis). Both stay in the corpus; a reader's surface shows the newest in the chain in the place of the first." },
    "superseded_by": { "type": "string", "pattern": "^syn-[0-9a-f]{12}$", "description": "1.15.0: the synthesis that revises this one; written by the tool that adds the revision." },
    "provenance": { "$ref": "provenance-stamp.schema.json" },
    "ext": { "type": "object", "additionalProperties": true }
  },
  "additionalProperties": true
}
